{
 "version": 1,
 "sources": {
  "runelite": "runelite-parent-1.12.33",
  "stashTracker": "a8caedca03159416dd5cd1948af6ecaf3fe24b9d"
 },
 "clues": [
  {
   "id": "hard_beckon_on_the_east_coast_of_the",
   "tier": "Hard",
   "text": "Beckon on the east coast of the Kharazi Jungle. Beware of double agents! Equip any vestment stole and a heraldic rune shield.",
   "area": "Kharazi Jungle",
   "x": 2954,
   "y": 2933,
   "plane": 0,
   "reqs": [
    "any:item:10472:1:Guthix stole|item:10470:1:Saradomin stole|item:10474:1:Zamorak stole|item:12257:1:Armadyl stole|item:12269:1:Bandos stole|item:12201:1:Ancient stole",
    "any:item:7336:1:Rune shield h1|item:7342:1:Rune shield h2|item:7348:1:Rune shield h3|item:7354:1:Rune shield h4|item:7360:1:Rune shield h5"
   ],
   "stash": "NORTHEAST_CORNER_OF_THE_KHARAZI_JUNGLE"
  },
  {
   "id": "medium_cheer_in_the_barbarian_agility_arena_headbang",
   "tier": "Medium",
   "text": "Cheer in the Barbarian Agility Arena. Headbang before you talk to me. Equip a steel platebody, maple shortbow and a Wilderness cape.",
   "area": "Barbarian Outpost",
   "x": 2552,
   "y": 3556,
   "plane": 0,
   "reqs": [
    "item:1119:1:Steel platebody",
    "item:853:1:Maple shortbow",
    "any:item:4315:1:Team1 cape|item:20217:1:Team cape i|item:20214:1:Team cape x|item:20211:1:Team cape zero"
   ],
   "stash": "BARBARIAN_OUTPOST_OBSTACLE_COURSE"
  },
  {
   "id": "elite_bow_upstairs_in_the_edgeville_monastery_equip",
   "tier": "Elite",
   "text": "Bow upstairs in the Edgeville Monastery. Equip a completed prayer book.",
   "area": "Edgeville Monastery",
   "x": 3056,
   "y": 3484,
   "plane": 1,
   "reqs": [
    "any:item:3840:1:Holy book|item:3844:1:Book of balance|item:3842:1:Unholy book|item:12610:1:Book of law|item:12608:1:Book of war|item:12612:1:Book of darkness|item:26496:1:Holy book or|item:26488:1:Book of balance or|item:26498:1:Unholy book or|item:26492:1:Book of law or|item:26494:1:Book of war or|item:26490:1:Book of darkness or"
   ],
   "stash": "SOUTHEAST_CORNER_OF_THE_MONASTERY"
  },
  {
   "id": "elite_cheer_in_the_shadow_dungeon_equip_a",
   "tier": "Elite",
   "text": "Cheer in the Shadow dungeon. Equip a rune crossbow, climbing boots and any mitre.",
   "area": "Shadow dungeon",
   "x": 2629,
   "y": 5071,
   "plane": 0,
   "reqs": [
    "any:item:10454:1:Guthix mitre|item:10452:1:Saradomin mitre|item:10456:1:Zamorak mitre|item:12203:1:Ancient mitre|item:12271:1:Bandos mitre|item:12259:1:Armadyl mitre",
    "any:item:9185:1:Rune crossbow|item:26486:1:Rune crossbow or",
    "any:item:3105:1:Climbing boots|item:23413:1:Climbing boots g",
    "any:item:4657:1:Ring of visibility|item:28327:1:Ring of shadows|item:28329:1:Ring of shadows uncharged"
   ],
   "stash": "ENTRANCE_OF_THE_CAVE_OF_DAMIS"
  },
  {
   "id": "hard_cheer_at_the_top_of_the_agility",
   "tier": "Hard",
   "text": "Cheer at the top of the agility pyramid. Beware of double agents! Equip a blue mystic robe top and any rune heraldic shield.",
   "area": "Agility Pyramid",
   "x": 3043,
   "y": 4697,
   "plane": 3,
   "reqs": [
    "item:4091:1:Mystic robe top",
    "any:item:7336:1:Rune shield h1|item:7342:1:Rune shield h2|item:7348:1:Rune shield h3|item:7354:1:Rune shield h4|item:7360:1:Rune shield h5"
   ],
   "stash": "AGILITY_PYRAMID"
  },
  {
   "id": "master_dance_in_ibans_temple_beware_of_double",
   "tier": "Master",
   "text": "Dance in Iban's temple. Beware of double agents! Equip Iban's staff, a black mystic top and a black mystic bottom.",
   "area": "Iban's temple",
   "x": 2011,
   "y": 4712,
   "plane": 0,
   "reqs": [
    "any:item:1409:1:Ibans staff|item:12658:1:Ibans staff u",
    "item:4101:1:Mystic robe top dark",
    "item:4103:1:Mystic robe bottom dark"
   ],
   "stash": "WELL_OF_VOYAGE"
  },
  {
   "id": "elite_dance_on_the_fishing_platform_equip_barrows",
   "tier": "Elite",
   "text": "Dance on the Fishing Platform. Equip barrows gloves, an amulet of glory and a dragon med helm.",
   "area": "Fishing Platform",
   "x": 2782,
   "y": 3273,
   "plane": 0,
   "reqs": [
    "any:item:1704:1:Amulet of glory|item:1706:1:Amulet of glory1|item:1708:1:Amulet of glory2|item:1710:1:Amulet of glory3|item:1712:1:Amulet of glory4|item:11976:1:Amulet of glory5|item:11978:1:Amulet of glory6",
    "item:7462:1:Barrows gloves",
    "item:1149:1:Dragon med helm"
   ],
   "stash": "SOUTHEAST_CORNER_OF_THE_FISHING_PLATFORM"
  },
  {
   "id": "master_flap_at_the_death_altar_beware_of",
   "tier": "Master",
   "text": "Flap at the death altar. Beware of double agents! Equip a death tiara, a legend's cape and any ring of wealth.",
   "area": "Death altar",
   "x": 2205,
   "y": 4838,
   "plane": 0,
   "reqs": [
    "item:2572:1:Ring of wealth",
    "item:5547:1:Death tiara",
    "item:1052:1:Cape of legends"
   ],
   "stash": "DEATH_ALTAR"
  },
  {
   "id": "elite_headbang_in_the_fight_arena_pub_equip",
   "tier": "Elite",
   "text": "Headbang in the Fight Arena pub. Equip a pirate bandana, a dragonstone necklace and and a magic longbow.",
   "area": "Fight Arena pub",
   "x": 2568,
   "y": 3149,
   "plane": 0,
   "reqs": [
    "any:item:7112:1:Pirate bandana|item:7124:1|item:7130:1|item:7136:1",
    "item:1664:1:Dragon necklace",
    "item:859:1:Magic longbow"
   ],
   "stash": "OUTSIDE_THE_BAR_BY_THE_FIGHT_ARENA"
  },
  {
   "id": "master_do_a_jig_at_the_barrows_chest",
   "tier": "Master",
   "text": "Do a jig at the barrows chest. Beware of double agents! Equip any full barrows set.",
   "area": "Barrows chest",
   "x": 3551,
   "y": 9694,
   "plane": 0,
   "reqs": [
    "any:item:4708:1:Ahrims hood|item:4856:1|item:4857:1|item:4858:1|item:4859:1|item:4860:1|item:30445:1:Echo ahrims hood|item:30519:1|item:30525:1|item:30531:1|item:30537:1|item:30543:1|item:4710:1:Ahrims staff|item:4862:1|item:4863:1|item:4864:1|item:4865:1|item:4866:1|item:30568:1:Echo ahrims staff|item:30570:1|item:30571:1|item:30572:1|item:30573:1|item:30574:1|item:4712:1:Ahrims robetop|item:4868:1|item:4869:1|item:4870:1|item:4871:1|item:4872:1|item:30447:1:Echo ahrims robetop|item:30521:1|item:30527:1|item:30533:1|item:30539:1|item:30545:1|item:4714:1:Ahrims robeskirt|item:4874:1|item:4875:1|item:4876:1|item:4877:1|item:4878:1|item:30449:1:Echo ahrims robeskirt|item:30523:1|item:30529:1|item:30535:1|item:30541:1|item:30547:1|item:4716:1:Dharoks helm|item:4880:1|item:4881:1|item:4882:1|item:4883:1|item:4884:1|item:4718:1:Dharoks greataxe|item:4886:1|item:4887:1|item:4888:1|item:4889:1|item:4890:1|item:4720:1:Dharoks platebody|item:4892:1|item:4893:1|item:4894:1|item:4895:1|item:4896:1|item:4722:1:Dharoks platelegs|item:4898:1|item:4899:1|item:4900:1|item:4901:1|item:4902:1|item:4724:1:Guthans helm|item:4904:1|item:4905:1|item:4906:1|item:4907:1|item:4908:1|item:4726:1:Guthans warspear|item:4910:1|item:4911:1|item:4912:1|item:4913:1|item:4914:1|item:4728:1:Guthans platebody|item:4916:1|item:4917:1|item:4918:1|item:4919:1|item:4920:1|item:4730:1:Guthans chainskirt|item:4922:1|item:4923:1|item:4924:1|item:4925:1|item:4926:1|item:4732:1:Karils coif|item:4928:1|item:4929:1|item:4930:1|item:4931:1|item:4932:1|item:4734:1:Karils crossbow|item:4934:1|item:4935:1|item:4936:1|item:4937:1|item:4938:1|item:4736:1:Karils leathertop|item:4940:1|item:4941:1|item:4942:1|item:4943:1|item:4944:1|item:4738:1:Karils leatherskirt|item:4946:1|item:4947:1|item:4948:1|item:4949:1|item:4950:1|item:4745:1:Torags helm|item:4952:1|item:4953:1|item:4954:1|item:4955:1|item:4956:1|item:4747:1:Torags hammers|item:4958:1|item:4959:1|item:4960:1|item:4961:1|item:4962:1|item:4749:1:Torags platebody|item:4964:1|item:4965:1|item:4966:1|item:4967:1|item:4968:1|item:4751:1:Torags platelegs|item:4970:1|item:4971:1|item:4972:1|item:4973:1|item:4974:1|item:4753:1:Veracs helm|item:4976:1|item:4977:1|item:4978:1|item:4979:1|item:4980:1|item:4755:1:Veracs flail|item:4982:1|item:4983:1|item:4984:1|item:4985:1|item:4986:1|item:4757:1:Veracs brassard|item:4988:1|item:4989:1|item:4990:1|item:4991:1|item:4992:1|item:4759:1:Veracs plateskirt|item:4994:1|item:4995:1|item:4996:1|item:4997:1|item:4998:1"
   ],
   "stash": "BARROWS_CHEST"
  },
  {
   "id": "hard_jig_at_jiggig_beware_of_double_agents",
   "tier": "Hard",
   "text": "Jig at Jiggig. Beware of double agents! Equip a Rune spear, rune platelegs and any rune heraldic helm.",
   "area": "Jiggig",
   "x": 2477,
   "y": 3047,
   "plane": 0,
   "reqs": [
    "any:item:10286:1:Rune helm h1|item:10287:1|item:10288:1:Rune helm h2|item:10289:1|item:10290:1:Rune helm h3|item:10291:1|item:10292:1:Rune helm h4|item:10293:1|item:10294:1:Rune helm h5",
    "item:1247:1:Rune spear",
    "item:1079:1:Rune platelegs"
   ],
   "stash": "IN_THE_MIDDLE_OF_JIGGIG"
  },
  {
   "id": "easy_cheer_at_the_games_room_have_nothing",
   "tier": "Easy",
   "text": "Cheer at the games room. Have nothing equipped at all when you do.",
   "area": "Burthorpe Games Room",
   "x": 2207,
   "y": 4952,
   "plane": 0,
   "reqs": [],
   "nothing": true
  },
  {
   "id": "easy_panic_on_the_pier_where_you_catch",
   "tier": "Easy",
   "text": "Panic on the pier where you catch the Fishing trawler. Have nothing equipped at all when you do.",
   "area": "Fishing trawler",
   "x": 2676,
   "y": 3169,
   "plane": 0,
   "reqs": [],
   "nothing": true
  },
  {
   "id": "hard_panic_in_the_heart_of_the_haunted",
   "tier": "Hard",
   "text": "Panic in the heart of the Haunted Woods. Beware of double agents! Have no items equipped when you do.",
   "area": "Haunted Woods (ALQ)",
   "x": 3611,
   "y": 3492,
   "plane": 0,
   "reqs": [],
   "nothing": true
  },
  {
   "id": "master_show_your_anger_towards_the_statue_of",
   "tier": "Master",
   "text": "Show your anger towards the Statue of Saradomin in Ellamaria's garden. Beware of double agents! Equip a zamorak godsword.",
   "area": "Varrock Castle",
   "x": 3230,
   "y": 3478,
   "plane": 0,
   "reqs": [
    "any:item:11808:1:Zamorak godsword|item:20374:1:Zamorak godsword or"
   ],